{
  "$schema": "https://json-schema.org/draft/2020-12/schema",
  "$id": "https://palantir-ontology.internal/contracts/event-envelope.contract.json",
  "title": "Event Envelope Contract",
  "description": "The 5-dimension WHEN/ATOP_WHICH/THROUGH_WHICH/BY_WHOM/WITH_WHAT event-log envelope shape (P230 section 3.1/3.3: 'when, atopWhich, throughWhich, byWhom, withWhat'), append-only per ADR-006. `withWhat` alone is intentionally open (event-type-specific payload); every other field is closed. Runtime-neutral. Real content P330.",
  "type": "object",
  "required": ["schemaVersion", "envelopeRev", "type", "when", "atopWhich", "throughWhich", "byWhom", "withWhat"],
  "properties": {
    "schemaVersion": { "type": "string", "pattern": "^[0-9]+\\.[0-9]+\\.[0-9]+$" },
    "envelopeRev": {
      "type": "integer",
      "minimum": 0,
      "description": "Per-row envelope revision, keyed for the on-read upcaster seam (ADR-006); legitimately empty upcaster registry at v1 is acceptable, an absent envelopeRev is not."
    },
    "type": {
      "type": "string",
      "minLength": 1,
      "description": "The discriminated event type. Open vocabulary (the legacy plugin alone carries 85 variants) — this contract fixes the envelope shape, not the closed set of type values."
    },
    "when": { "type": "string", "format": "date-time" },
    "atopWhich": {
      "type": "string",
      "minLength": 1,
      "description": "The target/subject this event occurred atop."
    },
    "throughWhich": {
      "type": "string",
      "minLength": 1,
      "description": "The mechanism (tool, hook, handler) this event occurred through."
    },
    "byWhom": {
      "type": "object",
      "required": ["identity"],
      "properties": {
        "identity": { "type": "string", "minLength": 1 },
        "role": { "type": "string" }
      },
      "additionalProperties": false
    },
    "withWhat": {
      "type": "object",
      "additionalProperties": true,
      "description": "Event-type-specific payload. May carry `memoryLayers` (Four typed memory forms, execution-plan.md DoD item 8) tagging which agentic memory layer(s) this envelope feeds.",
      "properties": {
        "memoryLayers": {
          "type": "array",
          "minItems": 1,
          "items": {
            "type": "string",
            "enum": ["working", "episodic", "semantic", "procedural"]
          }
        }
      }
    },
    "valueGrade": {
      "type": "string",
      "enum": ["T0", "T1", "T2", "T3"]
    },
    "lineageRefs": {
      "type": "array",
      "items": { "type": "string", "minLength": 1 }
    }
  },
  "additionalProperties": false
}
