{
  "schemaVersion": "1.0.0",
  "envelopeRev": 0,
  "type": "sic_approved",
  "when": "2026-07-18T09:25:00Z",
  "atopWhich": "sic:sic-0002",
  "throughWhich": "src/altitude1/sic-gate.ts",
  "byWhom": {
    "identity": "agent:claude-sonnet-5",
    "role": "worker"
  },
  "withWhat": {
    "sicId": "sic-0002",
    "memoryLayers": [
      "episodic",
      "semantic"
    ]
  },
  "valueGrade": "T2",
  "lineageRefs": [
    "evt-0043"
  ]
}
